{
  "schema": "aerovia.onnx-parity/v1",
  "flowTolerance": 0.001,
  "pressureTolerance": 0.05,
  "fixtures": [
    {
      "methodId": "topology-mlp",
      "networkId": "room-pillar",
      "input": [
        [
          -0.19162410497665405,
          -0.012930803000926971,
          -0.2103322297334671,
          0.15267200767993927,
          0.13907094299793243,
          -0.0427701398730278,
          0.054276060312986374,
          -0.03572225198149681,
          0.17088381946086884,
          -0.12685075402259827,
          -0.2070155292749405,
          -0.014055737294256687,
          -0.035526227205991745,
          0.017605707049369812,
          0.03935152292251587,
          0.09526195377111435,
          0.016204020008444786,
          -0.03698866441845894,
          0.04773254692554474,
          0.09091359376907349,
          -0.2142522782087326,
          -0.16982480883598328,
          -0.07216355949640274,
          0.016531167551875114,
          0.026486676186323166,
          -0.03407913073897362,
          0.004358802456408739,
          0.1663704514503479,
          -0.10162701457738876,
          -0.05459699407219887,
          -0.05200384184718132,
          0.1664145290851593,
          -0.05151844397187233,
          0.12792056798934937,
          -0.08171990513801575,
          0.33267977833747864,
          0.09885145723819733,
          -0.07981587946414948,
          0.005706976167857647,
          0.18136176466941833,
          0.06694961339235306,
          0.08481565862894058
        ],
        [
          0.03168961778283119,
          -0.040792111307382584,
          0.05583079904317856,
          -0.05659489706158638,
          -0.1506587415933609,
          -0.07578376680612564,
          0.06042364239692688,
          -0.032453615218400955,
          -0.09667983651161194,
          -0.06256143003702164,
          0.2187812775373459,
          -0.16513513028621674,
          0.1532563865184784,
          0.029750892892479897,
          0.02320430986583233,
          0.09284386783838272,
          -0.08905903995037079,
          0.05521157383918762,
          -0.012714945711195469,
          -0.05390186607837677,
          0.15418244898319244,
          0.05046387389302254,
          -0.11408664286136627,
          -0.07003699988126755,
          -0.005510890856385231,
          0.0038250426296144724,
          -0.1033136174082756,
          0.15119966864585876,
          -0.06787179410457611,
          0.13048066198825836,
          0.03868495300412178,
          0.05349934101104736,
          -0.037423498928546906,
          0.03065904602408409,
          -0.15483076870441437,
          -0.031334489583969116,
          0.1933855265378952,
          -0.013482701033353806,
          0.04864370822906494,
          0.036116138100624084,
          -0.08771742135286331,
          -0.039798300713300705
        ]
      ],
      "rawFlows": [
        [
          -0.19162410497665405,
          -0.012930803000926971,
          -0.2103322297334671,
          0.15267200767993927,
          0.13907094299793243,
          -0.0427701398730278,
          0.054276060312986374,
          -0.03572225198149681,
          0.17088381946086884,
          -0.12685075402259827,
          -0.2070155292749405,
          -0.014055737294256687,
          -0.035526227205991745,
          0.017605707049369812,
          0.03935152292251587,
          0.09526195377111435,
          0.016204020008444786,
          -0.03698866441845894,
          0.04773254692554474,
          0.09091359376907349,
          -0.2142522782087326,
          -0.16982480883598328,
          -0.07216355949640274,
          0.016531167551875114,
          0.026486676186323166,
          -0.03407913073897362,
          0.004358802456408739,
          0.1663704514503479,
          -0.10162701457738876,
          -0.05459699407219887,
          -0.05200384184718132,
          0.1664145290851593,
          -0.05151844397187233,
          0.12792056798934937,
          -0.08171990513801575,
          0.33267977833747864,
          0.09885145723819733,
          -0.07981587946414948,
          0.005706976167857647,
          0.18136176466941833,
          0.06694961339235306,
          0.08481565862894058
        ],
        [
          0.03168961778283119,
          -0.040792111307382584,
          0.05583079904317856,
          -0.05659489706158638,
          -0.1506587415933609,
          -0.07578376680612564,
          0.06042364239692688,
          -0.032453615218400955,
          -0.09667983651161194,
          -0.06256143003702164,
          0.2187812775373459,
          -0.16513513028621674,
          0.1532563865184784,
          0.029750892892479897,
          0.02320430986583233,
          0.09284386783838272,
          -0.08905903995037079,
          0.05521157383918762,
          -0.012714945711195469,
          -0.05390186607837677,
          0.15418244898319244,
          0.05046387389302254,
          -0.11408664286136627,
          -0.07003699988126755,
          -0.005510890856385231,
          0.0038250426296144724,
          -0.1033136174082756,
          0.15119966864585876,
          -0.06787179410457611,
          0.13048066198825836,
          0.03868495300412178,
          0.05349934101104736,
          -0.037423498928546906,
          0.03065904602408409,
          -0.15483076870441437,
          -0.031334489583969116,
          0.1933855265378952,
          -0.013482701033353806,
          0.04864370822906494,
          0.036116138100624084,
          -0.08771742135286331,
          -0.039798300713300705
        ]
      ],
      "flows": [
        [
          -0.19162410497665405,
          -0.012930803000926971,
          -0.2103322297334671,
          0.15267200767993927,
          0.13907094299793243,
          -0.0427701398730278,
          0.054276060312986374,
          -0.03572225198149681,
          0.17088381946086884,
          -0.12685075402259827,
          -0.2070155292749405,
          -0.014055737294256687,
          -0.035526227205991745,
          0.017605707049369812,
          0.03935152292251587,
          0.09526195377111435,
          0.016204020008444786,
          -0.03698866441845894,
          0.04773254692554474,
          0.09091359376907349,
          -0.2142522782087326,
          -0.16982480883598328,
          -0.07216355949640274,
          0.016531167551875114,
          0.026486676186323166,
          -0.03407913073897362,
          0.004358802456408739,
          0.1663704514503479,
          -0.10162701457738876,
          -0.05459699407219887,
          -0.05200384184718132,
          0.1664145290851593,
          -0.05151844397187233,
          0.12792056798934937,
          -0.08171990513801575,
          0.33267977833747864,
          0.09885145723819733,
          -0.07981587946414948,
          0.005706976167857647,
          0.18136176466941833,
          0.06694961339235306,
          0.08481565862894058
        ],
        [
          0.03168961778283119,
          -0.040792111307382584,
          0.05583079904317856,
          -0.05659489706158638,
          -0.1506587415933609,
          -0.07578376680612564,
          0.06042364239692688,
          -0.032453615218400955,
          -0.09667983651161194,
          -0.06256143003702164,
          0.2187812775373459,
          -0.16513513028621674,
          0.1532563865184784,
          0.029750892892479897,
          0.02320430986583233,
          0.09284386783838272,
          -0.08905903995037079,
          0.05521157383918762,
          -0.012714945711195469,
          -0.05390186607837677,
          0.15418244898319244,
          0.05046387389302254,
          -0.11408664286136627,
          -0.07003699988126755,
          -0.005510890856385231,
          0.0038250426296144724,
          -0.1033136174082756,
          0.15119966864585876,
          -0.06787179410457611,
          0.13048066198825836,
          0.03868495300412178,
          0.05349934101104736,
          -0.037423498928546906,
          0.03065904602408409,
          -0.15483076870441437,
          -0.031334489583969116,
          0.1933855265378952,
          -0.013482701033353806,
          0.04864370822906494,
          0.036116138100624084,
          -0.08771742135286331,
          -0.039798300713300705
        ]
      ],
      "pressures": [
        [
          0.0,
          0.0,
          0.0,
          0.0,
          0.0,
          0.0,
          0.0,
          0.0,
          0.0,
          0.0,
          0.0,
          0.0,
          0.0,
          0.0,
          0.0,
          0.0,
          0.0,
          0.0,
          0.0,
          0.0,
          0.0,
          0.0,
          0.0,
          0.0,
          0.0,
          0.0,
          0.0
        ],
        [
          0.0,
          0.0,
          0.0,
          0.0,
          0.0,
          0.0,
          0.0,
          0.0,
          0.0,
          0.0,
          0.0,
          0.0,
          0.0,
          0.0,
          0.0,
          0.0,
          0.0,
          0.0,
          0.0,
          0.0,
          0.0,
          0.0,
          0.0,
          0.0,
          0.0,
          0.0,
          0.0
        ]
      ]
    }
  ]
}
